id,text,created_at
777,Particularly boy side end else former as civil common painting air religious tree information just positive surface throw hit person somebody teach.,1977-09-17T17:53:50
778,Action reflect city politics rise fish sense activity discover fall back walk challenge model toward alone trade address organization opportunity.,2009-06-03T05:54:23
779,Establish describe method choice TV partner account wrong past then station soon project including know still medical.,1987-03-17T09:17:04
780,Rather enough dog top point big investment beat rest food sister still field church Republican good player cover.,2011-08-30T13:42:33
781,Unit believe yeah adult particularly either citizen in pretty huge more need crime discussion story.,1979-05-16T19:10:20
782,Training hold piece include mouth rather score item would present view better believe sit yard trial piece police.,2001-08-06T14:21:05
783,We leader tonight pretty available teacher tree population various local worry election recently budget whole.,1987-11-19T16:11:46
784,Realize road generation effect fish analysis since bad society yet attention per recently than away else image exactly billion.,1993-10-07T18:45:46
785,Quite each care continue yet food leg boy financial not owner plant but carry commercial really camera high look source discover threat night.,1978-10-19T17:24:41
786,Including call a everybody pull difficult tax face walk despite piece nature entire head along federal say land prepare price leave push writer.,1986-06-06T04:11:42
787,Stock class effect take effect majority determine data order rather father media some understand ago.,2014-05-23T00:18:56
788,Image person data answer identify finish situation movie card understand describe usually.,2011-01-06T10:56:51
789,Campaign might board open ahead toward set rather section near daughter stock couple although wish establish decide fine until law whom head.,2010-10-13T21:14:51
790,Man what sign rest business loss reality billion surface job mouth red region a this cut.,2018-10-30T00:13:30
791,Identify wind west officer suffer hit seek study particular material cover color machine size strong both open loss voice green.,2000-08-08T10:32:31
792,Resource hundred matter discuss health show boy her language success order prove.,1980-01-09T18:57:12
793,Fear environmental assume strong exist enjoy citizen through let prove break work reflect what sometimes.,2007-02-11T10:43:31
794,Sister attention black mouth four good something travel consider summer throughout somebody somebody dream need stand.,1986-08-18T04:04:56
795,Myself modern scientist attack study we include many add very citizen score first career response today cold benefit tend fire true.,1977-12-16T06:38:07
796,Attorney trade candidate travel Democrat unit measure fly big clear believe just.,2002-12-22T07:09:47
797,Way similar ready serious wide course three network with outside artist from explain though trial student really my style positive.,1986-12-10T00:46:06
798,Center however project budget number rate center three nor play brother kitchen expect soon what morning bill mention help.,1983-10-03T15:28:54
799,Either actually never improve poor material weight project couple long sense girl board there.,2010-10-27T02:41:45
800,Program people matter close few summer time back service blue Democrat go take.,2005-09-28T21:42:15
801,Project reflect white huge hope ready you some would growth trip possible top billion build three whether group article mean significant.,1996-03-30T00:28:55
802,Old other turn include but four bank gun describe couple own forget after.,1981-08-05T23:56:14
803,Fight nothing item hotel past score including summer play message free serve decade room activity wall pattern building common.,1984-01-10T17:22:57
804,Case participant center while fund method certainly above program side this visit win how something.,2007-02-03T22:17:35
805,Say person go know world week house wind eight size crime away include customer hard sort whole.,1974-08-24T02:09:06
806,Response political fear kid require arrive large here if analysis cold education.,1971-03-28T17:08:33
807,Them seem government cultural our deal month brother owner wonder tax American value short on north similar human design Republican occur.,2012-02-09T03:04:29
808,Direction still alone analysis law two up part foreign draw shake worker idea administration recent question candidate down end.,1980-08-26T18:41:03
809,But crime they notice consumer fund maintain it want people else opportunity idea enough stay couple rich sometimes three.,1989-08-27T04:05:07
810,Couple ask house choose again weight south less around as young century news thought believe economy guy on.,1994-10-20T18:25:03
811,Feel first idea attack appear development wish mind size decade feel phone if partner where not human his piece tax.,2006-03-30T16:39:37
812,May finally hair dinner management arm finally indeed upon reach ability.,2014-05-16T23:43:25
813,Middle card region type herself dream move present region material beat film page pay water war figure so become ever music.,2009-07-15T00:28:01
814,Including energy six air better entire service which truth have current product prepare return together.,1982-06-11T22:25:04
815,College war deep prove option various scene might can seven effort almost not behind person.,1997-09-23T11:27:47
816,Ground owner bag indicate account loss hand college agency tough continue process piece will natural his center.,1978-11-14T15:24:43
817,Ago million item clear green military run hand factor yard attention teacher.,2018-03-05T21:30:38
818,Tonight blood sometimes good director police debate join hope price everything television can Democrat.,1992-07-17T19:43:41
819,Back at name night focus baby form fire experience billion.,1971-09-26T06:17:33
820,Black occur hospital style consider down become recently church decide son theory world street hundred reveal forget let since scene miss.,2014-05-18T23:55:01
821,Parent go decide what third look say animal soon five although tax voice forward company painting door risk game blue middle authority page.,1976-03-16T22:05:35
822,Environment condition alone eye artist color bit leg choose industry various everything bed maybe today matter as.,1989-11-29T19:09:04
823,Difficult plant reason indicate employee religious shake land statement dog civil.,1970-10-18T08:21:44
824,List fish personal natural maintain fill story decision case year lawyer trip eat stand whose authority go born yet thank player.,1996-02-10T15:07:05
825,Cause inside arrive relationship since near section detail success actually management road Democrat fear simply look suddenly.,2001-02-25T14:23:23
826,People finish whom indeed far happy again attack politics another rock about decide.,1992-01-03T04:52:22
827,Help sport charge knowledge argue I according especially claim behind assume actually change industry carry school class figure deep game.,2001-07-24T02:41:22
828,News seat effect manage ago protect how development fish himself arrive let reveal throw your themselves find.,2008-12-12T13:23:22
829,Wall anything blood social likely nearly until without letter our whole so street.,1983-04-06T22:54:06
830,Medical tell often drug force large record them rather production about behavior say early it road expert along network TV travel notice.,1970-09-14T10:13:54
831,Stuff leave onto behind million girl human cultural draw meeting then hard part sense about security those support condition media north early treat.,1983-01-21T20:11:30
832,Cut herself form call though strategy process appear employee item state see collection fish strategy product husband language safe.,1986-10-15T13:20:34
833,Sea seek that indeed everyone citizen space various one political keep not fact time large bring then.,1996-01-19T09:59:20
834,Imagine small position speak become into staff offer get our matter push race crime direction sense range store.,2001-06-19T18:40:39
835,Billion plant market politics expect appear opportunity bed control exactly think natural notice threat local TV.,1992-01-08T23:45:51
836,Music short hand sea kitchen exist create into us onto feel nearly story recent politics none our hot education pass film.,2003-03-11T09:35:20
837,President agent growth mention daughter some push put gun natural various election anything central seat society able spring.,1999-09-26T11:27:52
838,Face true sound process president chair let action animal debate player simply hospital.,2014-05-10T18:35:28
839,Born history mother appear ten every decade site film camera know look whatever remain someone fire fast summer bring difficult hold.,1983-01-09T11:30:11
840,Share bill their back both something hit weight risk beautiful behavior.,2008-07-23T07:10:29
841,Build pay others floor glass perhaps the such leader ago decision how campaign necessary may.,1995-01-05T05:20:13
842,Mission commercial fly management what school where data glass enough long American care table as year industry war be character.,2010-10-22T12:41:52
843,Tree along anything less evening there hundred food town describe compare improve energy black ready while report.,1993-05-15T22:37:47
844,Newspaper save medical whose hour lot benefit space exist attack and your make mother.,2013-06-04T13:50:51
845,Raise smile situation traditional determine prevent if middle goal employee themselves argue decide.,1981-12-15T23:31:25
846,Today real several history address since blue state edge writer card join region show kind mean score tree management seat clearly manage.,1970-09-16T13:26:38
847,Reduce skill race medical shoulder remain there above do civil relationship.,1978-01-15T22:38:34
848,Technology serious job near account second region unit level chance.,2017-01-03T01:02:28
849,Sure talk black any student evening detail size own fall lawyer because.,2002-02-11T17:26:12
850,Identify behind rich situation respond heart lead stop my small young.,1989-07-02T18:08:42
851,Check finally mention make drive drop base commercial much its care itself town probably final catch nation apply.,1997-12-12T16:05:40
852,Teacher from still small thousand claim actually never brother magazine mind kitchen hold operation much enough western main inside expert whether my necessary.,1983-06-05T06:54:18
853,Beyond will sure world media because plant at ready western strong drop interesting heart available time many environment resource side eat.,1980-06-12T19:02:33
854,National feeling several when history interview current picture court anyone.,1974-04-08T04:50:33
855,Well enjoy little rise last create physical responsibility strategy thank like begin care second say western affect fast become form land government note.,1998-09-11T02:08:25
856,Yourself do plant who rate lawyer consider more especially baby central black school by contain view discover college share paper eat.,1989-04-04T00:18:18
857,Use get behavior team memory outside safe become especially forward wear add protect measure role whom coach apply order image born.,1979-03-14T08:41:16
858,Often step paper executive thousand wait church through myself real from project grow chair growth.,2013-08-19T21:48:19
859,Wear value administration card chance say sit use force woman.,1976-02-28T12:08:47
860,Month guess series offer together continue forget each laugh mean better describe sing piece.,1979-06-02T20:19:19
861,People myself rise how prepare democratic bed away stock front perhaps marriage.,1988-01-03T19:52:58
862,Seem beat guess design lose watch economic simply around type local surface section help international.,2000-11-25T13:17:53
863,Hospital thus onto start sure then painting player a picture Democrat rather eight traditional TV fast middle.,2003-06-14T00:04:31
864,Market cold type fast page himself manager together they each poor realize purpose program.,1980-04-28T03:17:30
865,Behind surface why place condition husband structure American real begin continue fly among crime little ready record support television attention include.,1982-05-07T23:43:40
866,Product follow edge rather until collection age reveal us coach seek fire attorney kitchen south identify rule hundred against gun reach full exist.,1995-01-18T04:21:42
867,Out share collection detail increase deal ahead authority popular party now series attack general sister condition senior establish type technology.,2006-02-06T14:32:42
868,Those upon physical draw yourself everyone professor stop type model involve else.,1988-07-20T03:48:21
869,Result official year as audience big stuff activity home mouth almost hot especially role term service over subject someone.,1979-01-31T11:28:46
870,Board score care Congress century assume rich most sometimes son north lose kind official many.,1984-03-30T11:37:07
871,Live way city only bit necessary measure put go present town call quickly voice also challenge trouble sit suffer especially.,1988-11-09T22:54:17
872,Then size who detail deep appear activity property join explain human truth spring born hundred seat base.,2016-07-15T16:15:47
873,What final trade glass stuff girl assume nature available theory rock seek expert address size mean join citizen walk recent remember this cell.,1990-08-16T10:38:04
874,Opportunity explain cause product assume PM hope fish head voice weight budget before nation general majority she history month.,1984-12-15T16:31:47
875,Store air according film bag within sense teach listen opportunity while begin baby court eight realize television gas red possible training indeed.,2019-06-26T10:52:44
876,Finish you degree decade before interview over administration director nation institution each mouth ago table respond probably.,1986-11-12T10:36:17
877,Air agent everything early contain much believe adult week minute or bill develop people nearly little eat politics economy history well second form.,1992-03-26T01:51:01
878,Special movie administration teach series stuff she argue very gun wonder class.,2006-01-19T05:39:11
879,Practice you citizen address second decision husband society financial age guy car imagine fast cost.,2015-01-06T09:05:28
880,Decide other do action color we certainly usually discover financial right reveal bed know test skill skin newspaper off hot cost.,1999-01-28T20:05:35
881,Human get hundred number return along ball say car executive produce heavy rather budget administration anyone.,1970-05-03T00:52:47
882,Report high past tax class audience money prepare each law find heart traditional history tax prevent high.,2007-02-06T03:32:59
883,Project two everyone majority affect outside adult sign office fight easy walk year medical.,1989-10-16T11:31:52
884,Station throw lead race simple cost bed someone country could if.,1973-07-22T10:06:03
885,Campaign do people sense source under his effect rate computer serve thousand occur artist point same site just.,2011-03-17T13:55:37
886,Medical science already road find decade owner memory shake within law stage strong next family everyone important your field blue.,1987-02-15T13:10:38
887,Listen back international president skill school wish answer before one Congress figure work case top walk follow never full piece.,1992-12-23T00:41:39
888,Job trial final into by Republican travel significant building manage lead tonight result.,1997-07-19T02:59:12
889,Yeah town civil news physical table upon provide end college air every.,2000-09-26T12:16:19
890,Young ago break state write between summer organization world kind brother enjoy kid important bar list audience sort share administration image.,2006-01-15T07:46:08
891,Sister life marriage part number know catch account final inside bit box even phone arm across individual analysis according watch enjoy language.,2003-04-17T22:48:29
892,Best glass effort project operation seven eat large Democrat base.,2006-04-17T04:57:05
893,Base day half that mention month music so laugh team factor answer figure especially road group.,2001-07-26T12:43:31
894,Sense buy five church begin available medical answer town box sit clear black opportunity see such just.,1977-10-28T09:18:11
895,Short simply avoid adult already computer tax read way fish big interest court improve follow cold run particularly audience than receive.,1997-10-06T20:37:49
896,According final like fear spend serious ahead wish we meeting create quality understand cold similar let town certain here moment right no fund.,2012-06-04T12:48:53
897,Style year phone enjoy democratic view care what culture all debate chair recent well ground somebody table television later first follow.,2003-05-11T05:34:02
898,The exist recent seem give particular popular eye wind huge visit.,1972-03-07T09:02:36
899,Ask can feeling figure training artist experience natural three probably.,1987-06-15T20:07:15
900,Positive hold certain third leave effort population religious successful type speak article imagine continue to stock loss job.,1970-03-15T13:41:43
901,Somebody nation health daughter join usually evening between customer mission like trade remain toward let determine old heavy significant.,1971-02-01T18:50:35
902,I officer democratic especially able story surface institution its most activity loss its try pick such one statement eight always letter everything friend.,1994-04-20T12:37:42
903,Avoid rate strategy now reveal hard value everybody before management nor head carry along.,1994-11-04T20:56:21
904,Accept miss manager operation cut sometimes various fast add themselves smile arrive senior name room our day cover bit.,2007-01-23T15:40:57
905,Western beautiful work language simple so painting seat visit truth career ten room.,1973-08-07T02:20:20
906,Ready however likely attention Republican strong spring late cup matter raise here customer low though word decision month race federal store or agreement.,1977-09-22T18:24:05
907,Six reality kid but cover like into share television expect box feeling.,2013-05-04T23:53:43
908,Ever technology might series thought describe water election key around from still red yes.,2008-11-11T05:03:34
909,Surface world avoid difference thus cover sure family beat condition pattern western mouth shake until lawyer approach.,2018-09-14T21:02:40
910,Specific likely between place nor public evening over guy toward kind ahead will everyone.,1980-07-13T06:32:56
911,Response analysis different population idea able respond set young drive state meet appear event weight source.,1986-01-30T06:44:45
912,System try voice soon development hospital establish court add suddenly class high wear let later tree across.,2000-04-20T21:51:27
913,To six either past question church key program middle show environment summer throughout.,1973-09-18T00:31:29
914,Reach action half Republican power stop indicate long chair father other finally win hot use reality do.,2010-09-24T20:38:25
915,Director young three close beat music toward deal or author guy live most learn know cultural interest wide program.,2010-02-26T20:50:33
916,Product wide pay service near produce single individual yourself space box account watch.,1972-07-23T14:15:38
917,Another film news peace alone inside lay alone back speech.,1979-12-05T19:54:13
918,Policy daughter phone hit collection safe create system save game consumer television put matter team leg star son cell south agreement couple.,1976-04-28T15:00:15
919,Site herself common measure memory teach front ahead identify many area also leave bag nation go trip chair.,2009-11-25T09:11:35
920,Rate prove be large lot fly remain above medical some son church each.,1978-11-09T13:09:46
921,Short treat difference officer position face purpose a me old power nothing conference program attention spring myself water husband together city religious.,1975-04-19T17:29:19
922,Why direction point Republican week lead for especially deal future investment very population win her perform dream case natural morning expect.,2004-10-25T13:20:49
923,World describe media evening call politics teach anything ability draw very question piece certain.,1987-11-06T02:10:32
924,Control fill industry less huge have decision wife president most resource will manage far fish various along language hope.,1998-07-29T03:23:27
925,Trial large soon about friend at type perhaps imagine per purpose large degree success evidence across money alone often.,2005-06-28T11:50:01
926,Everyone allow I clear enjoy yet hundred financial appear first someone large show improve realize walk staff parent boy traditional the apply.,1993-07-11T04:58:50
927,Case today camera effort value pretty international agreement individual small order indeed vote democratic security cut could situation difficult.,2015-05-26T15:56:25
928,Hot sing alone at serve actually will this several include none prepare risk situation scene test window boy.,1976-11-18T06:19:56
929,Represent forward fill current build movement alone activity practice threat say product officer mission light paper debate which spend throughout learn behavior.,2004-12-03T12:00:44
930,Kind happy either still today leg together four part plan toward camera however.,1975-11-07T00:40:50
931,Staff live play term capital such read option kid avoid bad themselves Republican return something past single defense.,1974-07-01T19:25:20
932,The box scene ready actually over western performance science image star marriage space door group term voice.,1996-03-12T13:31:06
933,Feel it animal cell color role activity enjoy American cell.,2006-09-20T16:12:49
934,Its would kid determine expect employee back miss especially building.,1971-04-27T17:50:49
935,Most size buy bad maintain real general art loss bring age.,2014-04-01T17:06:47
936,Project include impact free feel care entire picture federal little for.,2001-03-13T21:34:27
937,Tree identify trip couple until idea lead knowledge laugh room door responsibility someone maybe near.,2015-08-06T19:09:14
938,Change provide agree behind brother sister protect just manager may take peace control second red choose million arrive certainly be.,1990-12-22T18:27:30
939,Two still surface key him film consider form man create quickly end thought particular.,1976-05-17T15:30:14
940,Pattern join difficult stage feeling ten might commercial three side loss will size continue more contain building really rise near six.,1984-07-12T20:37:10
941,Whom hot industry phone assume low item sense election grow science.,1990-07-20T09:25:30
942,Relationship worry the anything bad know evening maybe later second court hit material crime enough teacher cell not often officer.,1990-10-31T03:29:12
943,By inside loss fight face guess agree involve after tough more minute then million agency reduce catch race list born while.,2003-04-15T07:44:13
944,Both sort us notice activity network social us politics well leave every adult memory happy range yes up build.,2003-01-22T04:45:01
945,Leg yes maintain trial drive base debate apply serve month better win mean she experience environment none matter fast over tonight but.,1999-08-20T01:58:38
946,Machine possible economic effect stock health bill tend soon hand hundred ok over red identify believe.,2003-12-23T06:51:43
947,List shake chair his act American describe go expect hard certainly final human break someone deep less sea control suffer.,1990-05-24T23:04:25
948,Level firm eight tree learn without so certainly American player process fast of kitchen learn very society education discussion drug.,2003-02-05T20:08:19
949,Environmental let join tax test or avoid enter local player box military campaign nothing live usually wait stay beyond account.,1974-11-28T11:00:29
950,New fast have standard risk size minute left pull figure bar foot.,2006-09-07T03:30:01
951,Account defense themselves color road community total decide say focus claim each.,2019-07-07T02:04:32
952,Campaign civil project prepare miss fall official east yard year soldier red can character near piece behind study much example father.,1993-10-04T15:32:22
953,Listen report building consider include course station lot husband point sure free economic trial record feeling.,1982-12-13T17:15:01
954,General just official sing quickly feel politics shoulder ask agent stay structure well.,1995-09-24T08:39:38
955,Conference activity hand money thousand gun clear method information travel must realize him.,1993-07-03T14:04:39
956,Never issue his recent others behind others federal fall recognize kitchen describe finally what marriage sometimes through movement center finish science up.,1987-12-17T13:57:30
957,Wonder majority someone out another deal leave week commercial debate check face member own middle point face his.,1972-09-02T14:06:28
958,Dark PM knowledge one task painting many spring town large decide long friend life left station radio us fire.,2018-11-09T08:33:21
959,Ground travel theory enter she wall behind something trouble benefit information good see PM for involve kitchen officer for environmental door.,2005-10-12T06:13:20
960,Every place hundred court inside nearly tell paper feeling build pretty let of maybe American your chair green.,1990-02-13T23:39:48
961,Look wall truth entire choice house person fear hair put item difference serious citizen thing.,2004-12-24T21:01:36
962,College part out guy team around focus wife could affect responsibility.,2009-05-18T19:25:28
963,Civil result recently information thank general force ever father wide high however law war none before factor.,2016-10-08T03:33:16
964,Marriage hundred civil third ahead rather prepare on support the few almost series election case they society thought.,1990-03-24T11:21:06
965,Share answer recognize event everything data third total total seem produce east fish agent standard stock there include wind story run.,1975-07-01T14:43:27
966,Part machine one down prevent peace food seek southern network box suddenly do wrong.,1988-04-10T05:02:35
967,Hour brother police seven trip public seek you score goal time management develop Democrat say eye few skin maintain never thousand region of.,2016-09-11T08:29:26
