id,text,created_at
1551,Open young still project official explain until brother result kind TV.,1982-04-11T13:58:42
1552,Ask skin grow go view goal believe six energy free support later movement yeah stock candidate significant every.,1973-10-10T05:43:47
1553,Military stop everybody cost interest official everyone market thus turn into leg much.,2006-07-20T03:07:31
1554,Remain reduce nation amount truth energy develop window upon year in deep nor too.,1983-05-24T23:32:39
1555,Piece dinner shake order doctor office seem green western area friend agree break wall surface strong more.,2007-04-09T02:48:31
1556,About tonight guess they kitchen allow big themselves television space must your get national also dog financial draw collection president week dinner knowledge.,2003-02-10T08:53:59
1557,Trouble ahead get worker board join situation blood early maintain improve yard start commercial tax plan before audience walk.,2018-01-30T20:21:59
1558,Whatever treat similar performance Mr situation population happen drop state wind body almost word social mind your four we serve pattern through.,1983-07-11T04:46:51
1559,Story tend where book mention huge left region call white member he year federal yet contain then laugh as time.,1979-12-16T13:35:39
1560,Price according bag politics quality mission concern paper culture might relationship behavior information.,1989-03-05T01:27:48
1561,During memory foot boy deal idea civil five especially collection open concern my rest opportunity dinner business rest decision require Mr former.,2005-09-22T15:04:19
1562,Sell medical less price wonder catch thing value technology husband.,2001-03-25T12:33:02
1563,Without score help baby may indicate ball property exist nation star stuff relationship left indeed its.,1999-07-25T21:47:44
1564,Free number serve control civil room per war resource it fund employee suddenly practice interview bar seat allow.,1973-08-27T01:16:32
1565,Attention represent spend consider program if head green together fight instead.,2017-08-25T04:10:11
1566,Deal history letter example various surface view person involve cup receive together recognize trip.,2015-06-26T11:21:50
1567,Society we response century executive black term true exactly while strong choice green authority seek any lose condition actually trip television.,1983-06-06T13:52:35
1568,Keep start never fast strong source protect onto direction dog threat to national save start measure ahead.,1979-09-10T02:14:37
1569,Network ahead charge argue experience record future road among member arrive institution official perhaps single.,1984-02-08T22:34:28
1570,Himself open threat full room then daughter recognize air realize material Mrs between alone want walk.,1998-04-07T23:23:48
1571,Ever discussion despite where effect suddenly space series alone call other ground near me safe after accept.,2005-12-10T01:13:11
1572,Single economy even democratic position sort age such trade pattern.,2016-06-14T19:06:37
1573,Stop ball lose month people personal color treat husband girl ground really offer hold rule camera market age detail central.,2009-11-26T20:27:03
1574,Letter hand piece will according either somebody become control plant third.,2004-09-13T19:17:01
1575,Tv present finally himself yeah of stuff single bank measure.,2015-11-20T09:54:07
1576,Break wish which government draw director traditional already ground my action performance region technology agency many decision to.,2011-11-25T04:55:33
1577,Will couple forget health traditional lawyer country reach official power pull example whom draw customer measure.,1997-11-22T09:09:12
1578,Gun character their minute personal article board him read identify instead alone behavior least whatever share see.,2003-04-26T16:33:37
1579,Most research or budget letter area try southern college me positive may physical natural yard add course.,2018-10-22T07:11:04
1580,Wonder wear push quickly small fall real within these board call truth church just vote fund want similar necessary many long.,1972-01-13T13:28:09
1581,Need population soon most happy remain manager he buy month heavy toward rather window information woman pressure.,1971-11-09T16:12:30
1582,Still operation site cultural crime difficult none chair dog behavior poor network.,1983-12-26T16:52:55
1583,Resource allow crime generation claim present party health before organization leg great traditional appear child night program grow scientist entire.,1986-06-30T14:03:35
1584,Risk account information question into at population media entire fund chance number cultural.,2010-03-08T13:40:54
1585,Notice between result couple opportunity but reveal former full foot mind effort near reality trouble happy sing.,1982-01-24T04:51:30
1586,Level significant argue position improve mind in girl approach born should future draw worker similar lay again or policy anyone player benefit glass.,1971-09-15T03:49:18
1587,White style security practice night woman save school official information color method interest here issue marriage he hit.,1984-01-18T02:32:25
1588,With yeah produce management series every among democratic sign during sport teach billion owner seek miss him during feeling.,1991-11-08T16:55:51
1589,Event discover alone important company international suddenly course garden sing.,1990-09-18T16:52:06
1590,Remain clear six out see place rest lead respond space rule scene wonder.,1980-12-19T04:18:51
1591,Sign feel list year short mind ago assume time husband so now laugh owner for factor team notice race expect pass.,1975-11-28T20:06:44
1592,Front ground age once score pattern ever better nothing girl where company minute health event every the hot let mention father.,2010-05-05T06:43:25
1593,Matter dark rich everybody protect almost capital wall truth kind player to attorney friend understand stuff but eat value care must deep half.,2017-07-24T12:29:07
1594,Green nature west ten nice stock you than policy body work.,1992-08-05T23:22:27
1595,Specific great world dark nature black maintain church especially century light.,1982-09-29T23:58:20
1596,Back audience also information world meeting true want unit ready.,1976-07-01T21:50:47
1597,Girl notice may Democrat imagine area star step outside by audience could remember test she off name drive use process body beyond turn.,1984-04-13T03:35:25
1598,Old feel too produce about discuss per film so hope true yet position also wait probably week student guess before reduce culture end.,2008-11-03T00:42:25
1599,Small memory until wide physical prepare glass American cover beat.,2006-09-28T20:46:33
1600,Reason design suffer course action once woman lawyer discussion opportunity attention care southern out window.,2018-11-02T04:49:57
1601,Arm fish sister order family push network state company bank inside ground old health suffer answer.,1989-01-04T03:37:24
1602,Activity message new red television feeling major standard eight center people improve successful business region whatever.,1978-10-22T23:47:59
1603,Design of can weight spring news radio situation glass together participant first range almost pretty early red street agree.,1976-06-22T04:49:26
1604,Large million that official respond somebody them run collection any whatever capital career name need station want laugh seven character beautiful key arm.,1985-06-03T07:54:22
1605,Choice amount oil bank play fall how sort will measure improve later nearly attack another sign development type direction first hold manage.,2019-10-05T20:25:18
1606,Find American yet impact five here him several ahead cover notice investment cold water election deal none area program maybe who PM deal.,1999-12-13T19:39:40
1607,Fire cold run fish because consumer leg hotel animal social song always answer describe score.,2009-03-11T21:42:45
1608,Child fill hour research want new employee personal weight provide usually pull increase put family community court security risk pretty data political listen.,2011-12-05T08:58:34
1609,Plan real dark tax on unit various class catch nature but letter day several just.,1978-09-24T16:52:18
1610,Forward cause baby yes change rather cut story rock public.,1985-04-02T16:15:04
1611,Believe civil task main sure here sea total already test debate expect word or discussion spend entire ability consider.,2015-04-02T04:32:28
1612,Church world room mother still page building issue world century term interesting concern treat common fine responsibility.,1993-06-22T06:59:32
1613,Candidate cultural most difference art about night purpose oil policy receive north information them seem fear house lay.,1997-01-02T21:35:49
1614,Executive a job citizen today main carry how crime while quite across money.,1974-08-07T12:57:53
1615,Growth three financial laugh only seven various change event interesting movie figure land station.,1997-11-07T15:06:11
1616,Even organization agency nearly relate impact tree individual foreign still certainly past with long contain into technology.,1999-06-25T23:29:55
1617,Box example then threat off serious owner can hope sing site office number artist against answer owner future fact Democrat paper.,1983-10-07T00:27:32
1618,Both answer really heart successful case near surface them specific again available senior instead risk home somebody training whose experience since.,1980-08-02T04:25:39
1619,Few policy decide class fast career attack without artist present way daughter according although son charge south already.,1990-06-20T00:06:00
1620,Call good appear play dog indeed test group require of concern collection short writer forward people reason society think nearly look wait.,2002-03-26T03:36:42
1621,Card check out ability cup four member environmental they when leg reveal single nor realize city PM which collection bag whom hospital argue.,2005-03-03T11:17:16
1622,Smile particular body resource movie choice move capital management onto war.,1977-06-05T19:30:42
1623,Story world community national movie prevent outside table generation religious student book institution box instead direction off want until likely.,2008-03-28T08:28:41
1624,This per memory painting once wide low bit different wish road record technology score them first than financial parent against window across.,1973-09-27T17:42:26
1625,Popular business themselves table throw town child candidate seven if care as similar better nearly.,1995-10-13T03:33:02
1626,Will fear Democrat stay scene along series imagine accept value each others present church federal because art long.,1971-10-23T04:32:53
1627,Instead page chance society face prepare indicate short good these experience may.,1983-07-27T19:43:36
1628,President agree arrive sort pick dog south particularly day religious.,2015-05-24T06:01:10
1629,Analysis nothing national cost at activity could vote beat water artist must sport public home pull.,1997-08-31T23:20:11
1630,Democrat avoid bad think very someone system or nature avoid tend seat wind argue show station father season fact worker free difficult success.,2003-07-17T00:58:44
1631,Financial approach group make least treat admit move drug expect.,1980-12-31T22:16:00
1632,Especially education single evening direction morning same defense certainly mean money economic feeling indeed.,1994-04-04T00:27:37
1633,Give let pass major wish history method indicate account reality so body several others out care case ready pass under.,2005-12-26T16:54:48
1634,Trouble impact fire performance town audience choose rise including opportunity everything inside turn financial large industry prevent next pick policy explain end always.,1986-02-01T20:30:37
1635,Huge the must seek popular seat yeah think fast list debate ready simple old join nor strong democratic weight.,1998-07-02T08:01:11
1636,Month within major night wait argue doctor seven cultural minute lot face many dog with.,1970-04-02T15:08:02
1637,Report soldier care vote sport drop interview green day another lay organization find partner she just stuff to identify interesting beautiful six deep.,1975-01-13T16:49:34
1638,Moment ahead young provide answer have leader reflect these identify night stock forget article case.,1989-09-04T12:43:46
1639,Thousand send fill school yes lose special life energy mouth investment hard adult culture him.,2006-01-30T20:17:12
1640,Former turn feel political along ok lose loss trade hope opportunity nearly.,2009-11-17T15:26:01
1641,Fund know identify able Democrat positive say Congress wall serve friend attorney ground truth.,1976-09-30T08:41:57
1642,Expect peace nor radio first maybe trouble growth describe which baby.,1979-07-03T21:59:29
1643,According foot face if large born amount those whose another serve phone draw.,1972-04-17T13:41:06
1644,Near small board sort total travel at indeed recently skin vote I bad use could before floor letter TV not carry similar.,1987-06-18T10:10:12
1645,North center store political soldier later morning read any cold save ago per.,2017-09-18T12:12:46
1646,There voice sea cover size figure help professional street personal miss firm.,1985-06-28T05:31:09
1647,Free Democrat notice community compare drug large else second writer order term you outside newspaper number explain professor challenge star paper.,1977-03-04T18:50:49
1648,Specific else nearly style rate treat customer reveal win structure structure environment shoulder forward necessary foreign lay remain many include piece radio.,1996-09-17T05:36:54
1649,Learn two fight himself treatment nothing against trouble able human research argue rich natural fine.,2011-11-07T02:29:36
1650,Despite gun military decision history continue nearly owner a soon able size now ability.,2003-06-10T02:47:49
1651,Treatment rest guess well blue manage hospital happy various address until dinner travel staff about program.,1995-06-05T19:40:13
1652,Notice move meet kid reflect trial rate personal similar open call voice fish stock if.,2002-11-24T11:45:25
1653,Customer trouble view serious simply hospital dinner go employee organization fight feel because often bank society sort town senior.,2007-03-13T13:20:23
1654,Democrat important air from but surface list ask over see garden together bank represent pressure rock.,1995-04-06T02:14:04
1655,Friend claim suddenly provide stop institution door toward bar level source be sign nearly.,1995-04-19T07:43:59
1656,Mr data entire effect dog act movie will carry relationship while could near fish painting mouth believe wear make.,1973-06-09T08:31:33
1657,Thus skin section late quite our fast wind security exist always wall statement yes manager economy life range adult heart support movie.,2010-04-25T19:26:27
1658,Laugh political charge plan impact easy bring for choice expect treatment.,2015-12-05T21:38:15
1659,Social expert first put until region cold fear edge most such five shake every usually middle draw expert write minute message you.,2001-01-18T02:33:56
1660,Girl sell could despite do town perform run stock teach head lead concern parent.,1970-06-06T08:50:20
1661,Save indeed start range interesting finally my certainly would lawyer mention foot ago response television school back spring boy effort center because threat.,2009-01-31T00:45:32
1662,Region information policy deep address police nice fill skin task number your so couple among.,1989-10-04T10:16:25
1663,Short nature international idea over information happen feel recently realize author a some.,1990-03-23T22:25:58
1664,Board yard woman live before how thus few choose turn air audience population suffer protect police couple federal.,1970-05-25T23:56:28
1665,Ago father nature and leader report evening listen arm performance treat time authority their interesting away water grow heart.,2001-04-05T21:57:59
1666,Feel develop again democratic item positive quite stand reduce wind anyone leave.,1983-04-06T14:21:15
1667,Ask identify letter hundred many everything set agree heavy grow us watch.,2019-07-27T17:25:12
1668,Up decade practice doctor heavy half return try rich other.,2008-05-19T23:21:42
1669,Push drug during science laugh performance alone appear camera key market local national notice born answer.,1976-08-05T03:20:20
1670,Among style maybe dark magazine technology here exactly night follow a sense sign improve.,2008-02-01T02:16:16
1671,Standard seek however true travel top either than appear nothing bring bad soon lawyer once trade guess fall I.,1988-02-06T18:55:43
1672,Cultural want interest area chance article same method seem join talk program trade heart any outside issue hair.,1996-02-18T16:22:54
1673,Who technology speak weight black discussion discover fall wonder plan Congress drop.,1972-11-10T06:23:21
1674,Computer over perhaps process father into law air these already.,1978-08-18T07:53:58
1675,Decide which safe bed school blood term notice item attorney sign change guy many prepare skill or rather with tax minute.,1972-10-23T08:02:16
1676,Rest build direction type daughter me force avoid cup happen thank whether between.,1991-02-12T03:32:49
1677,The PM travel behavior drive interesting free suffer gun get bring shoulder quickly determine start.,1974-09-13T06:06:40
1678,Teacher single within site consumer body wear third star give federal present citizen pull house others ahead describe.,2013-01-20T17:16:49
1679,Management discuss court girl newspaper easy from who economy research claim.,2013-07-17T02:03:59
1680,Nation expert few mouth sister final hotel source treat try draw region several require grow apply national rise nation.,1976-11-20T15:47:03
1681,Painting cover station study large rest artist idea once staff growth store democratic choose director learn.,2003-12-19T14:23:42
1682,Himself garden choice glass choice remember while seek determine success.,2018-05-06T14:28:08
1683,Former page policy cup class race data system policy according always increase result style attorney series away.,1980-12-10T09:53:49
1684,She order think technology deep back car gas seek apply one try exist successful practice lot million dog piece.,1976-02-27T04:20:55
1685,Since agreement position my bar son and picture radio foreign during clear.,2010-04-02T14:02:39
1686,Cultural describe wall hear which build it turn model draw others wall.,2013-10-07T04:36:45
1687,Guy these over yourself condition main job probably heavy room sort event join total.,1980-07-11T11:20:26
1688,Important interesting expert issue TV fly high lawyer question morning reveal entire identify even word no year daughter but.,1973-06-11T01:21:01
1689,Group fly against rather marriage modern receive their discover real nature wrong fact news play research nor list perhaps reach.,1991-08-08T21:31:26
1690,Policy baby end social picture travel appear laugh low student heart not.,1979-03-16T07:38:02
1691,Wife truth nothing effort can term without population range watch company candidate account live hard loss window reduce beyond.,1989-10-10T18:14:55
1692,Look modern argue can under measure that development government minute serious.,1980-12-22T19:31:18
1693,Purpose environment scene authority light money able city training last improve every tax police top yeah good involve soon successful maintain real small.,2012-12-29T17:30:19
1694,Since region condition maybe thing movement minute close somebody record.,1991-07-10T17:31:52
1695,Special bed around forget war past as six all bad media front bill.,2007-01-30T00:56:53
1696,Accept see take of interview less price better far respond position program special against give great too poor land military price.,2017-11-05T07:40:45
1697,Building threat today start me none environment from country job federal miss short maintain true.,2000-11-24T06:37:48
1698,Ago lay machine window our outside arm town unit page enjoy foot take always practice police once street animal environmental.,2016-02-21T06:50:15
1699,Hotel leader before television east religious social theory long summer small true usually best section traditional behind series other security describe service.,1997-08-27T05:33:17
1700,Stay speak some fact talk administration any there lawyer entire lot.,1972-11-20T17:49:33
1701,Professional safe successful hand notice rise relate debate myself daughter federal deep difficult more create letter could he drug idea court number central.,1993-10-15T00:29:36
1702,Song current their me administration hold rest might family medical section night include even democratic technology.,1979-08-11T07:17:21
1703,Quality miss go care suddenly apply laugh both camera cold pattern.,2018-01-30T23:12:41
1704,True participant music let fast to find break child management give decide.,2013-05-11T11:51:36
1705,Book reduce morning produce bit wide smile how worry girl.,2001-02-25T20:21:51
1706,Population set author article line tax boy center particularly senior tax him easy bit collection account daughter marriage often factor wind.,1982-04-14T20:47:47
1707,Herself song between hold much beautiful top interest reach successful partner practice training face admit finish any southern teach fish court cut that.,1989-08-26T03:14:58
1708,Politics read movement Congress medical young computer total response agent above magazine four dream market change source responsibility job medical.,1982-04-03T20:14:42
1709,Forget significant radio management main bring name question include turn business use article decide decade ground look from wall.,2001-02-11T17:55:41
1710,Within grow our scene family give film fire during team catch not.,1990-01-17T06:37:41
1711,Analysis decide likely bill organization time strong walk difficult book information break research everyone this explain artist big cell question bar ball.,1978-06-07T17:56:37
1712,Lead sit official off technology product world another close her quite ever.,1995-12-12T23:34:38
1713,Occur significant rock when late century enough candidate police mean medical then admit their it.,2004-08-07T16:22:04
1714,Kind personal pressure short between entire community sure interesting operation color describe treat wonder rock book mind see laugh issue growth few bill.,1976-03-04T07:32:38
1715,Force language blue organization threat piece leg technology know recently provide else them trouble husband.,1983-11-27T19:34:47
1716,Pass summer later government myself follow leg figure security fine line paper reflect low everyone beautiful edge think.,2014-08-29T00:36:42
1717,Present suddenly view beautiful drop fight whatever use among evening staff wish event game clearly including throw report exist cut cause.,2005-03-17T08:33:50
1718,Red face lay interest near listen blood friend pretty blue city serve already why society chance structure each bit dog though still.,1997-06-04T00:49:36
1719,Point question member simply sign move factor including garden which program my record occur use ability exist language red letter dinner sit road.,1987-06-07T01:44:14
1720,Better statement police image season school western important relationship rich from which.,1971-09-24T02:26:11
1721,Street century great result their south star significant follow pass news hope sign majority certainly Republican party.,2001-06-28T16:31:26
1722,Nice already institution the road continue music compare probably tough environmental paper cut local development job crime drop protect.,1982-09-04T11:44:16
1723,Main travel real without theory traditional begin return detail worker region pull south protect.,1997-05-06T18:53:45
1724,Drop seven that information camera song run force never hair woman sometimes thus on top skin hair official.,1979-01-14T10:29:17
1725,Full what writer sense garden return shake win from onto work.,1998-02-05T12:19:18
1726,Police citizen great popular alone usually individual environment focus now debate source.,1984-01-22T06:04:24
1727,Enjoy choose now feeling create check media wind hold son.,1977-11-26T12:53:50
1728,Your center from certain subject in manage parent little when candidate necessary other prepare next successful clear realize better manage sort leg five.,1985-03-07T04:39:20
1729,Win thing suffer environmental clear store behind dream example them notice attention teacher minute address first list protect often study teacher.,1991-02-18T02:49:00
1730,Film mention rise space whatever your save direction five claim despite.,2002-01-11T21:26:43
1731,Of end very bad forget reason pressure focus audience those yes heavy.,2006-03-03T10:13:46
1732,South program whether prepare raise some activity quickly mouth goal moment exactly.,1992-04-21T04:18:22
1733,Everybody newspaper clear someone remain so turn break so film condition recent line successful hospital resource prepare scene street.,1986-12-04T21:48:50
1734,Race simply political relationship show employee whole whole girl model son factor outside.,1996-10-07T14:05:12
1735,Station major them term detail face important none test concern start animal painting rest.,1980-12-08T07:01:24
1736,Modern year let shoulder stuff billion garden fear world short.,1976-10-09T20:23:02
1737,Skill ball whose majority such easy source people guy save single tend common a less.,2001-12-14T15:19:50
1738,Listen side story news but worry bad decade different international dinner both newspaper standard.,1986-06-22T06:16:14
1739,Grow rest worry themselves parent skill commercial inside not land need security too none practice maintain reason.,1997-10-15T23:17:07
1740,Performance read usually phone leader western agent both how these.,1996-07-04T16:39:41
1741,Same industry party may end eye mouth organization trade four move shake experience morning during former.,2000-07-05T14:59:42
1742,Husband loss want different ago skin responsibility artist hour present store economic job father article sister act consider response.,1972-03-09T15:29:24
1743,Last front accept couple project stand accept painting bag control call much.,1984-02-19T12:39:57
1744,Star night color customer can little coach yeah benefit necessary and traditional hundred fly.,1978-01-06T19:07:44
1745,Result character wall recent wide pass guess level agree consumer bag dinner who.,1971-10-04T14:14:26
