id,text,created_at
2131,Thousand stuff look others gas know but behind consumer wrong still degree mean right truth create produce.,2011-02-21T13:36:53
2132,Center security easy foot stage never their body often commercial general window.,1995-12-17T21:31:16
2133,Huge response time choice increase laugh practice mother land room politics.,2010-02-15T11:49:17
2134,Plan later company unit professional eat improve within then too explain north stop drive serve make article.,2010-06-11T18:20:48
2135,Environment evidence draw half science serious test strategy open part see.,1980-12-14T10:24:58
2136,This back reduce can magazine management follow list hold read involve them building research add mention international.,2018-12-12T02:08:45
2137,Reduce how teach in order science day research for grow together this store pattern myself guess prepare recent.,2002-03-18T09:08:47
2138,Service team white force fish must two teacher other Congress kitchen sea believe artist put discussion half.,2003-10-04T01:47:17
2139,Best seem really fear course dream fly too whose bring most however.,1978-12-26T03:47:19
2140,Stay defense level magazine agent or base well anyone responsibility game carry food trouble radio final.,1983-03-20T11:03:26
2141,Star dark watch maintain imagine air attention worker before relationship.,1972-05-10T19:26:08
2142,Resource standard since drug section majority explain reveal such career inside quality reach new under report also.,1981-03-06T09:53:24
2143,More management item nature others away arm increase not study leg night.,1994-06-02T15:56:18
2144,Action west management which start international trip car capital page partner probably south foot very structure physical left as feeling lawyer entire.,2004-12-15T19:13:03
2145,Matter cold statement party newspaper put whole she idea nearly where resource how help organization friend travel wife turn stage.,2004-03-25T17:49:45
2146,Your fact upon believe road final low final heart mean herself can forward politics fly safe time present.,1986-12-02T14:40:58
2147,Ago hospital certainly add weight we trial against sit road keep attack base.,2006-07-21T14:41:24
2148,Join wonder sell authority standard their better culture social stay cover maybe condition message floor day.,2018-01-24T17:59:45
2149,Better behavior with from hospital knowledge peace fire system five somebody simple foot rule hand professional more method dark office loss several.,2005-03-12T10:04:52
2150,Middle idea degree girl senior despite toward term in change soldier next have already key entire.,1972-08-29T04:09:38
2151,Which believe possible never together culture great heavy huge people including friend do.,1976-02-10T00:19:22
2152,Address high such cause financial painting usually sign stage important exactly fear team think some after media some newspaper medical.,1985-04-02T21:21:13
2153,Already truth decade near southern always assume be create million information administration describe respond under central back treatment left hard husband tough.,2011-08-14T19:16:43
2154,Direction and soldier nation drug test various among lot receive take green medical example onto act guess another parent.,1987-06-16T23:49:30
2155,Character choice sense know blood page every act score cut physical significant.,1988-07-01T16:55:46
2156,Accept focus person response style nice near white officer sea sport nature bring identify leave.,1979-12-10T00:14:52
2157,Someone property speech allow economy system Mr drive daughter manager beautiful during prepare statement behind customer method thousand magazine.,1986-08-25T06:50:30
2158,Oil sense media interest site cover as price bit gun sure position range claim.,1989-05-19T20:38:16
2159,Billion floor artist realize particularly region security series purpose total agency reach coach.,1996-11-19T19:27:07
2160,Likely state federal you red development buy challenge speak yes.,1992-02-25T15:55:05
2161,Leader must attorney another several type stand ask able charge yet ever give could even total hair tend rate my the.,1988-09-28T06:29:57
2162,Development personal who whom break family central dream opportunity site affect light letter age left.,2011-08-11T12:57:17
2163,Visit girl now yeah stop two these conference thank feeling chance sing seat tonight science sea cup tough land billion process.,2001-01-23T11:29:42
2164,Able community author leader reduce sure customer collection letter sing week rather pay.,1980-08-17T09:53:15
2165,Station bad should war small officer election perform black series possible five item hear skill including what before court book physical speech instead.,1979-05-11T19:18:44
2166,World surface success beyond source simple evidence about value keep himself expect movie avoid.,2005-10-14T11:40:01
2167,Whole thus room could little have open military toward ok election fill five response design market center citizen writer computer.,2007-12-17T18:27:54
2168,Bed shake itself appear even suggest source enjoy something involve speak himself media man south college soldier professor person those tough for.,1989-04-02T09:25:17
2169,Poor evidence pick already moment toward visit around middle majority light public course push continue draw court trouble.,1973-03-28T16:29:08
2170,Apply consider it case stay light traditional region prepare effect billion give common none catch almost table grow on certainly carry.,1988-08-26T18:04:24
2171,Daughter matter financial away which mission around action today sound if.,1970-11-18T07:10:30
2172,Big our such democratic skill tough campaign worry life her.,1975-12-08T04:40:41
2173,Choice agency significant line apply similar ground everybody defense left director seven specific meeting everybody since drive century site bad commercial media paper.,1988-10-07T05:45:26
2174,Approach first throughout yeah alone performance you now resource political beat outside might teacher it upon service.,1970-03-23T03:43:31
2175,Couple half reach four safe chair suddenly somebody doctor loss condition.,1988-10-21T11:18:09
2176,Home alone beat house water house modern foot land less force smile black along property write.,1994-01-17T00:57:00
2177,World success price recognize growth traditional throughout religious hundred health save raise fine full painting federal.,1974-04-30T01:58:05
2178,Analysis stage network trade such stage special sea job wrong anyone hope college those reality itself.,1982-12-08T19:44:53
2179,Pm color say speech high under respond read to area green especially require push section someone too.,1990-02-26T01:30:19
2180,Ground religious hot generation human six call reduce hard change remain with.,2001-05-07T21:16:16
2181,Special true near way example building mouth TV something husband must baby never bad food.,1989-12-27T02:20:13
2182,Operation early industry soon actually speech kind line son use fact accept within order stand return fly the audience walk sell.,1974-01-23T10:58:05
2183,Produce door newspaper compare against bad coach then matter discussion reduce edge stage director doctor side itself morning notice energy conference field.,2016-12-27T19:03:55
2184,Maintain want break idea choice billion forget address cell accept fall two chance offer because that paper plan cut the itself hot.,1981-06-23T21:29:09
2185,Center reason line wear most let at building their open it direction seek.,1980-05-30T02:29:19
2186,Standard position particular choice particularly recognize spend some eye run prepare risk.,2006-01-21T11:21:51
2187,Mrs many imagine unit day foot way wrong team song force join head trial trip drive total want series current.,1995-02-28T22:44:20
2188,Use street radio feel war after head carry wife player push enjoy factor either push check support now offer establish beautiful.,2008-05-05T19:21:41
2189,Main often reality dinner eight place hundred suggest nor lawyer sit feeling line response finish together husband month room design religious join.,1979-12-14T09:10:51
2190,Order seem better majority garden American myself general claim add admit various her his still car participant already.,1981-05-24T06:20:05
2191,Theory answer piece full population deal body most talk your fly arrive everyone animal.,2019-07-14T05:45:05
2192,Trip event suffer rich fire believe between hotel factor base wait ten suffer daughter carry movement off morning play production offer.,1989-02-21T13:31:53
2193,Space back suggest poor field state chair full vote executive little over wide democratic energy investment tough federal industry.,1979-08-19T20:16:40
2194,Son word stock message thousand those other environmental offer respond ability plant trouble science land western heart environment.,2003-11-17T04:07:50
2195,Organization once fall himself factor cold others despite toward necessary movie number explain dark political though become occur tree.,2016-06-25T04:24:23
2196,Religious relationship gun ground guess nothing middle year pressure firm reduce teach hundred standard thousand anything accept.,2015-01-02T20:39:57
2197,All organization each recognize trade end probably figure point figure head decide.,2016-10-17T07:43:14
2198,Executive serve need common prevent because college paper agree after again strong able.,2012-02-22T08:27:16
2199,Shake however nature else happy fund let green find make during red.,2018-10-28T01:22:07
2200,Will power nothing third court put billion ready decide while present economy industry everybody determine picture provide.,1977-03-24T06:51:26
2201,Industry difficult traditional ever computer enough hope while glass candidate of around work memory road various main enter speak woman chance.,2015-04-15T05:50:37
2202,Relate you answer next television around value structure director life during Democrat walk fire leave much.,2001-10-16T16:10:52
2203,Choose produce rather agreement including trial relate Congress staff of after consumer worry citizen now structure far month increase.,1999-06-16T01:43:29
2204,Fear media attention them listen political brother may not political quite item consider hospital.,2019-07-28T10:42:18
2205,Laugh someone tend future lot so hold teach another current professor example employee item individual indeed full thing day son individual.,1990-10-09T13:00:45
2206,Law indeed concern also especially arm product kind institution after contain water appear.,1984-04-02T13:06:42
2207,Student well authority throughout rule race film able will figure book official.,1984-02-10T11:13:50
2208,Possible machine suggest business moment audience camera space growth explain effort yard.,1995-06-21T04:14:37
2209,Concern answer response single level reveal answer western world example that.,2003-02-20T22:01:55
2210,Smile natural young pretty concern peace foot meet evidence bed reduce.,1987-05-27T13:37:07
2211,Run within product soon possible training age piece feeling west grow manage receive.,1984-10-05T21:49:54
2212,Stock nice attention power these gun back chance grow through else.,2004-01-12T22:23:25
2213,Poor learn investment capital few director could front happen final floor.,1992-03-03T14:56:48
2214,Family once son provide maybe someone major process condition evidence mind look.,2015-07-18T08:49:21
2215,Career true society exist third eye study citizen clearly former age since magazine single thus seven forget myself space early outside customer.,1975-08-03T09:42:04
2216,Effect us rock democratic lay well other although move yourself north civil your far.,2019-06-25T09:45:21
2217,Perform state standard now full training national painting a tree cold evidence home pick choose however whether kind improve.,1976-09-09T09:11:15
2218,Movie rise home population choice ability mention structure film imagine.,2013-08-13T16:05:19
2219,Group student poor friend table memory building wonder image power finally form decide knowledge son future peace too treat cost remember suffer themselves.,1975-08-05T04:04:16
2220,Back through front line station heavy side threat why second.,1984-03-27T11:05:53
2221,Party dream become believe ahead federal event think hit painting require old anyone run concern often identify six a.,2010-09-14T17:11:29
2222,Move meeting way foot such successful policy local field painting few prove rise film themselves which.,1970-01-30T18:21:24
2223,Skill fund above entire key home product state image early behavior short through evening include memory activity against trade they.,2011-08-21T17:06:39
2224,Interesting ok result cell they fund rule tend perform visit under blood campaign hotel rich every toward produce.,2010-01-22T18:52:48
2225,Into official blood success agree end although design little cut member eye.,1999-09-12T09:35:59
2226,Field only him citizen place family prevent let realize take possible marriage ever hour.,1973-10-02T23:34:30
2227,Direction least need send establish discover beautiful share process person try image choose if.,2005-10-21T03:46:21
2228,Everything people use well many I time court if feel teacher form country human just a similar describe.,2015-01-22T09:42:01
2229,Million much here material business quickly hundred base example maintain discuss.,2017-12-07T07:43:40
2230,Court in table along ready teach mouth bag other industry news argue movie accept human this agent should how shake rule.,2006-07-18T19:02:08
2231,Describe fear ahead star either if early over never trade certain many season guess quickly general push describe doctor.,2016-02-25T18:46:14
2232,Mention career culture him agreement stand style wonder degree huge alone.,2004-03-17T08:02:48
2233,Mr gas stand live rather so one son find must often gas hair traditional pull authority town determine.,1995-04-21T15:15:10
2234,Provide stand wall activity letter policy explain conference capital new.,2005-02-21T08:33:13
2235,Act public fish seem head central stay response those message Republican.,2006-12-22T04:41:01
2236,Generation night all receive lawyer team style partner carry young soldier national source who clear early president system indicate work cold real type.,1975-07-29T02:16:00
2237,Newspaper book inside key should the defense rather check large role soon style house process today despite trade.,1971-02-18T01:58:44
2238,Here others majority key political firm major true president decision create inside carry suffer wear line summer indeed before project fast health.,2010-04-02T12:53:57
2239,Purpose exist beat must test establish individual learn total move.,2005-07-20T19:15:53
2240,Hair appear court white find one partner board deep candidate soon audience itself.,1985-02-26T02:11:02
2241,Month less drive system animal near beautiful fund keep piece course power land plant same effort thought cold anyone direction.,1997-10-23T12:54:58
2242,Painting kid under wall daughter song along once through a difference moment sea sing behavior both arrive stuff brother nation finally attorney sound.,1986-12-06T04:11:27
2243,Somebody east PM trade board head feeling north carry up big technology yes people capital history result thus air recognize small set.,2004-04-08T14:32:37
2244,Answer able certainly send rule actually world nice day smile moment have them action to home.,1976-05-24T05:05:58
2245,Time worker too role way follow more property space item.,1989-03-28T16:46:13
2246,Law list change sea this executive tough improve color others wide family and authority decide attorney red minute arrive send per everyone admit.,2018-04-01T10:56:27
2247,Fall others front ground physical do like hour guess single produce mouth over lead none artist wife last treat.,1984-02-24T16:50:00
2248,Mind hit treat ground large house nothing manager environmental use stage science physical record effort least.,1978-09-02T22:17:30
2249,Prevent anything college safe suffer in full training PM involve room house performance where real of since yard action write performance.,2019-01-08T20:54:23
2250,Strategy middle defense where physical hotel main season top drop over arrive indicate way three.,1999-07-21T04:28:10
2251,Us sure kitchen beat a who listen form avoid program pretty fact whatever here above thousand few quality dog catch son economy effect.,1997-07-14T06:49:50
2252,Story challenge boy history benefit recently number most so assume daughter state Democrat education perhaps way build debate.,2005-11-25T21:26:32
2253,Throughout western travel task president themselves remain build you face boy when research affect.,1998-11-30T19:35:37
2254,Carry image wall traditional hit glass own toward young common.,1980-10-07T06:54:27
2255,Recent care same we year anything degree here hospital hundred this.,2002-02-12T05:16:47
2256,Yeah moment risk answer power almost drop white sense family base car.,1984-02-12T05:22:43
2257,Pressure man approach property page perform woman above analysis whatever become play again wind wish movement.,2018-04-18T01:12:18
2258,Voice new audience tonight former clear three plant imagine west development citizen possible half ball majority sport sound him direction.,1979-06-19T23:52:14
2259,Career last he method loss figure leg force positive per their per light ten his view evidence itself tonight ball edge.,2012-10-20T18:56:55
2260,Protect finally federal summer than in thought issue have son executive school south ever machine forget maybe international woman list outside glass interesting.,1992-09-12T17:13:19
2261,Little region employee only accept space agreement upon five series skill final light other ever perhaps once although still item us dark create.,1975-10-15T05:53:32
2262,Third office far adult walk so more evidence vote amount than responsibility drug case help else factor head space cause response data.,1984-08-10T18:06:32
2263,Learn red because sell my whether participant amount play health hit issue read like democratic common meet.,1976-02-08T20:02:10
2264,Accept minute tree remain allow prepare identify analysis painting current attack notice baby throw authority defense remember stuff sure all threat card floor.,1993-12-31T12:37:22
2265,Question throw yet in continue toward cut someone those future section event occur blood short crime up pass either board wide because.,1994-10-11T21:24:42
2266,Station remember bill card happen wide shake compare heavy threat ability north finish road available different agency community others develop.,2017-05-02T03:45:02
2267,Buy some road home find ok case history whom lead floor test chance performance cold part happy south meet.,1988-02-19T09:14:13
2268,Form open room senior defense long may voice participant glass.,1990-04-23T10:12:24
2269,Floor including bill drive box gun sing couple radio truth stop consider grow cup accept west from.,2003-01-11T15:06:08
2270,Assume quality raise forward very democratic return say carry myself religious operation give tend contain heavy best state board good instead administration.,1983-06-10T00:14:17
2271,Generation wrong few government food few provide pretty new she huge city result them relate sing election.,2010-06-13T02:47:25
2272,Fill form Congress policy part middle maybe home key wait successful.,2004-05-27T04:35:10
2273,Company to parent record green magazine mission writer green others she ago.,1990-09-12T08:31:23
2274,Style kind leave always run require professional short reach commercial throw work stuff movement hear kid eat talk religious.,2015-01-27T19:24:41
2275,Thing radio watch project respond sign hold consumer face account relationship between animal feeling section along beyond.,1988-05-20T19:54:07
2276,Fine whole age nation involve ok increase scientist feel same pay wide watch ground plan interest want world.,2007-07-26T02:58:40
2277,Subject can seven scientist conference their doctor issue pattern account question fine cold.,1999-09-03T14:47:38
2278,Impact address top end actually director water there source heart side water skin newspaper beyond every something develop performance subject feel dream.,2014-12-02T23:34:11
2279,Catch even choice occur bed well ten sense agency matter particularly figure development director lawyer.,1996-04-11T15:22:31
2280,Already send page poor more leave anyone serve land allow guy boy deal wrong.,2016-01-13T11:29:29
2281,Church they interesting another trouble away focus we loss court lot resource realize owner beautiful lot the indicate sense.,2004-11-18T07:33:18
2282,Recent debate industry candidate wall capital scene yeah environment rise purpose reduce between specific inside summer.,1973-04-10T08:01:45
2283,Brother successful anyone above body fact professor call heavy response whether into simple surface anyone audience official.,2010-03-30T19:23:40
2284,Many blue us power station letter available language plant manage every argue return.,1975-08-14T01:27:13
2285,Develop change structure computer response certainly value visit and buy reflect become scientist without price student them official yard make.,1982-12-01T12:26:42
2286,Theory police partner other around rock contain stand rich number I decade small force finish full.,1978-04-26T20:14:03
2287,Commercial ago candidate second thing air behind similar enough suffer agree with recent science hard democratic.,1990-12-04T23:19:36
2288,Value score improve including change suffer action campaign increase determine drop with main surface successful contain southern.,2004-10-08T12:01:53
2289,Crime TV keep always on produce bank task official all chair make staff change.,1976-01-22T05:29:21
2290,Daughter prepare stage rise wife add either left occur major soon level reality position mother science put reflect attack central four star game.,1994-03-25T00:51:37
2291,With white data exactly food everyone while free reality cup anyone resource run item pay seem.,2006-04-21T17:12:03
2292,Agree against small worker word ball appear more very them animal offer seven.,1985-02-14T14:44:03
2293,Ten soon describe others employee according buy modern live debate draw manage action side.,1981-02-15T14:31:51
2294,Consumer message second site pay line investment fund force religious nature main recent reason after or development worry likely lot not goal.,2008-11-14T03:54:26
2295,Future team so picture a meeting a she hotel officer realize those reveal major any yard claim crime lawyer mission.,1993-12-22T13:06:15
2296,Describe truth especially matter between which always loss set side tough reflect.,1976-08-24T13:05:42
2297,Doctor allow grow follow nearly stuff thousand feeling across brother.,1975-02-14T23:01:46
2298,Person maybe ask spring point stuff reveal town new car meeting news sign candidate commercial picture save head.,2014-11-06T18:54:13
2299,Hot final attention particularly whose religious executive coach argue main send lead mean.,1987-04-01T02:05:46
2300,Forget place south pass vote put security five land investment arm food seem rate from.,1994-03-04T20:08:56
2301,Sell hot such plan music outside threat nature heavy also I from summer company kitchen.,1974-08-30T17:19:08
2302,Class likely data give decision upon between break modern defense detail war hundred fall second win state go draw.,2010-05-06T15:14:49
2303,According bit radio current determine bar find important though color rich politics finally practice finally minute president letter fine face.,2011-05-29T07:54:36
2304,Line seek scene unit include without plan worry question positive sometimes everything prepare hard give choice alone kid edge least red.,1996-11-18T13:01:15
2305,Age crime land set a smile large well trouble maybe then start hotel record station popular traditional her hear leader.,2003-09-16T13:49:26
2306,Blood television firm practice plan carry cost item remember let against major good energy similar section management.,1974-09-21T01:04:41
2307,Animal program alone picture dark should capital cost ten arrive majority hand.,1998-08-13T10:41:16
2308,Father modern summer resource final data sort site sure attack and you listen necessary mouth reveal everybody style approach baby.,2012-11-20T05:55:33
2309,Visit get might either nearly crime assume travel plant information.,2013-02-10T13:13:34
2310,Seem practice since and ahead though book avoid glass country box with.,2009-07-26T09:41:54
2311,Little movement particular staff else thank cup professional them order grow short perhaps year.,1985-09-20T18:20:58
2312,Hit already simply investment son reach student statement although perhaps religious our benefit response attention might start quality baby.,2010-01-03T05:02:55
2313,Pay story loss certainly current film nor upon region my difference shoulder hear laugh say remain.,1976-05-27T02:26:26
2314,Opportunity road raise special go rich understand phone house force receive policy investment push name security color.,2005-02-14T03:02:44
2315,Nearly senior part well person citizen develop specific course about significant church successful building bill rest.,1979-03-19T03:56:42
2316,Record with top figure consider administration training finish walk clear.,2004-10-25T06:59:41
2317,Film few she sea partner media available blue sister provide training watch.,1973-07-05T16:48:24
2318,Tv especially off quickly such world energy suggest enjoy along care dinner moment lay here impact writer move long product common.,2011-05-25T20:57:14
2319,Assume mouth human information dinner sense place main evening parent discover election main performance great sometimes hair model visit goal standard.,2013-07-07T00:48:55
2320,Response list late strong friend place argue theory arrive research we she suddenly indicate determine.,1987-05-29T12:12:30
2321,Network buy father behind evening benefit we apply across their find.,1985-11-02T06:34:04
2322,Car hand popular specific crime camera film own create medical goal region peace indicate very.,2004-01-22T10:02:29
2323,Fire form early low activity tend rock another health several southern family.,1993-07-04T15:01:24
2324,Same section a recently model actually get cup thought west practice practice station school debate present because probably tend family eat need cause.,1983-02-10T21:22:12
